ID	TITLE	BRAND	MODEL	PLUS	COLOR	SCREEN_SIZE
1043696	Interfone HDL AZ-01 Branco	N/A	N/A	False	N/A	N/A
2961099	"Smartphone  Samsung Galaxy S5 SM-G900M Dourado com Tela 5.1"", Android 4.4, 4G, Câmera 16MP e Processador Quad Core 2.5GHz"	samsung	galaxy s5	False	N/A	5.1
3031744	Smartphone LG L90 Dual D410 Preto com Tela de 4.7”, Dual Chip, Android 4.4, Câmera 8MP e Processador Quad Core de 1.2 GHz	lg	N/A	False	N/A	4.7
3507499	Smartphone Samsung Galaxy Pocket 2 Duos SM-G110B Branco com Dual Chip, Android 4.4, Wi-Fi, 3G, GPS, Câmera 2MP, FM, MP3 e Bluetooth	samsung	N/A	False	N/A	N/A
3507899	"Smartphone  Samsung Galaxy S5 Duos SM-G900 Preto com Dual Chip,Tela 5.1"", Android 4.4, 4G, Câmera 16MP e Processador Quad Core 2.5GHz"	samsung	galaxy s5	False	N/A	5.1
3608270	Smartphone LG G2 Lite D295 Branco com Tela de 4.5”, Dual Chip, Android 4.4, Câmera 8MP, 3G e Processador Quad Core de 1.2GHz	lg	N/A	False	N/A	4.5
3638254	"Smartphone Samsung Galaxy Young 2 Duos G130M Branco com Tela 3.5"", Dual Chip, Android 4.4, 3G, Wi-Fi, GPS, Rádio FM e Câmera de 3MP."	samsung	galaxy young 2	False	N/A	3.5
3638255	"Smartphone Samsung Galaxy Young 2 Duos G130M Cinza com Tela 3.5"", Dual Chip, Android 4.4, 3G, Wi-Fi, GPS, Rádio FM e Câmera de 3MP."	samsung	galaxy young 2	False	N/A	3.5
3842557	Smartphone Alcatel One Touch Pop C7 Branco com Tela 5”, Dual Chip, Câmera 8MP, Android 4.2, 3G e Processador Quad Core de 1.3 Ghz - Vivo	N/A	N/A	False	N/A	N/A
4174800	Smartphone Samsung Galaxy Ace 4 Duos G313M/DS Cinza com Tela de 4”, Dual Chip, Android 4.4, Câmera 5MP, 3G e Processador Dual Core de 1GHz	samsung	galaxy ace 4	False	N/A	N/A
4188382	Smartphone Samsung Galaxy Ace 4 Duos G313M/DS Branco com Tela de 4”, Dual Chip, Android 4.4, Câmera 5MP, 3G e Processador Dual Core de 1GHz	samsung	galaxy ace 4	False	N/A	N/A
4457760	"Smartphone Desbloqueado Samsung Galaxy S6 Edge SM-G925I Verde com 64GB, Tela de 5.1"", Android 5.0, 4G, Câmera 16 MP e Processador Octa Core"	samsung	galaxy s6	False	N/A	5.1
4626851	"Smartphone Microsoft Lumia 640XL Dual Preto com Windows Phone 8.1, Tela de 5.7"", Dual Chip, 3G, Câmera 13MP e Processador Quad Core de 1.2 GHz"	microsoft	N/A	False	N/A	5.7
5409353	"Smartphone Samsung Galaxy Win 2 Duos TV G360BT Branco com Dual Chip, Tela de 4.5"", TV Digital, Android 4.4, Câm. de 5MP e Processador Quad Core 1.2GHz"	samsung	N/A	False	N/A	4.5
7259387	"Smartphone LG K4 Indigo com 8GB, Dual Chip, Tela de 4.5"", 4G, Android 5.1, Câmera 5MP e Processador Quad Core de 1GHz"	lg	N/A	False	N/A	4.5
7259389	"Smartphone LG K10 TV Índigo com 16GB, Dual Chip, Tela de 5.3"" HD, 4G, Android 6.0, Câmera 13MP e Processador Octa Core de 1.14 GHz"	lg	N/A	False	N/A	5.3
7528303	Smartphone Multilaser MS50 Colors Branco com Tela 5.0”, Dual Chip, Android 5.0, Câmera 8MP, Wi-Fi, 3G, Bluetooth e Processador Quad Core de 1.3 GHz	N/A	N/A	False	N/A	5.0
7923488	Smartphone ASUS Zenfone II ZE551 16GB 4G Tela 5.5 ZE551ML-6C705WW - BVOLT	asus	N/A	False	N/A	N/A
10025985	Telefone de Mesa Estilo Roda Azul c/ Luz - AR5063	N/A	N/A	False	N/A	N/A
10119246	Headphone Sense Oex Hp-100 Preto	N/A	N/A	False	N/A	N/A
10202297	Protetores Premium Iphone 4/4s Coloridos Dgipod1578 Isound	apple	iphone 4	False	N/A	N/A
10215527	Bumper Face Mirror Series Iphone 4 E 4s / Película (Bd02)	apple	iphone 4	False	N/A	N/A
10215531	Bumper Face Mirror Series Iphone 4 E 4s / Película (Bd03)	apple	iphone 4	False	N/A	N/A
10215535	Bumper Face Mirror Series Iphone 4 E 4s / Película (Bd05)	apple	iphone 4	False	N/A	N/A
10215539	Bumper Face Mirror Series Iphone 4 E 4s / Película (Bd08)	apple	iphone 4	False	N/A	N/A
10215551	Bumper Face Mirror Series Iphone 4 E 4s / Película (Bd04)	apple	iphone 4	False	N/A	N/A
10215553	Bumper Face Mirror Series Iphone 4 E 4s / Película (Bd06)	apple	iphone 4	False	N/A	N/A
10215568	Bumper Face Mirror Series Iphone 4 E 4s / Película (Bd01)	apple	iphone 4	False	N/A	N/A
10226488	Fonte Atx Cx430 Corsair 1v V.3 430w Real 80 Plus Bronze	N/A	N/A	True	N/A	N/A
10226623	Suporte Veicular 360°Universal Smartphones/Celulares/Gps4.3	N/A	N/A	False	N/A	N/A
10229098	Kit Telefone Celular Fixo Prokd-6000 Preto Proeletronic	N/A	N/A	False	N/A	N/A
10230429	Camiseta Decote V Plus Size	N/A	N/A	True	N/A	N/A
10298119	Bumper Face Mirror Series Iphone 4 E 4s / Película (Bd07)	apple	iphone 4	False	N/A	N/A
10380246	Fone Com Microfone Phn-M82mv/Bk Com Cont. Volume Mymax Preto	N/A	N/A	False	N/A	N/A
10380728	Headset Fone Confort Multilaser Ph044 Super Bass C/ Espuma	N/A	N/A	False	N/A	N/A
10384640	Jogo De Dardos Tabuleiro Alvo +Dardos	N/A	N/A	True	N/A	N/A
10413451	Fogão Delplus 5 Preto - Bivolt	N/A	N/A	True	N/A	N/A
10414163	Elka-Gilofone Girafa Xilofone 834	N/A	N/A	False	N/A	N/A
10427453	Impressora Etiquetas, Argox, R400 Plus	N/A	N/A	True	N/A	N/A
10443581	Pulseira Bracelete Cabo De Dados Iphone 5 / 5s / 5c / 6 / 6 Plus Azul	apple	iphone 5	True	N/A	N/A
10474045	Suporte Veicular Volante Celular Carro Gps Smartphone Iphone   Preto/Vermelho  Preto/Vermelho  Preto/Vermelho  Preto/Vermelho  Único  Único  Único  Único	N/A	N/A	False	N/A	N/A
10496932	Botão Adesivo Coração Iphone-Ipad	N/A	N/A	False	N/A	N/A
10499130	Colchão Casal King Verticoil Smart Preto Sistema c/ Antifungo e Antialérgico - (193x203x23 cm)	N/A	N/A	False	N/A	N/A
10515587	Colchão Casal Padrão Verticoil Smart Preto Sistema C/ Antifungo E Antialérgico - (138x188x23 Cm)	N/A	N/A	False	N/A	N/A
10515663	Baterial Recarregável P/ Telefone S/ Fio 600mah 2,4v Genérico	N/A	N/A	False	N/A	N/A
10515674	Colchão Casal Queen Verticoil Smart Preto Sistema C/ Antifungo E Antialérgico - (158x198x23 Cm)	N/A	N/A	False	N/A	N/A
10515789	Colchão Solteiro Padrão Verticoil Smart Preto Sistema c/ Antifungo e Antialérgico - (88x188x23 cm)	N/A	N/A	False	N/A	N/A
10515990	Colchão Solteiro Verticoil Smart Preto Sistema c/ Antifungo e Antialérgico - (78x188x23 cm)	N/A	N/A	False	N/A	N/A
10529083	Mirror Cast Multilaser Au906 - Espelhamento De Tela Do Smartphone Ios Ou Android	N/A	N/A	False	N/A	N/A
10553283	Bracadeira Iphone 4	apple	iphone 4	False	N/A	N/A
10553363	Bracadeira Iphone 5	apple	iphone 5	False	N/A	N/A
10553429	Bracadeira Iphone 5c	apple	iphone 5c	False	N/A	N/A
10554907	Película de vidro ultra temperado Asus Zenfone 5 A501	asus	zenfone 5	False	N/A	N/A
10555284	Película de vidro ultra temperado iPhone 5, 5s, 5c	apple	iphone 5	False	N/A	N/A
10556111	Bumper Iphone 6 Branco	apple	iphone 6	False	N/A	N/A
10569423	Fone De Ouvido - Rosa - Fatboy	N/A	N/A	False	N/A	N/A
10570471	Fone De Ouvido Estilo Dj Com Graves Nítidos Shl306	N/A	N/A	False	N/A	N/A
10578514	Cabeceira Casal Plus com Criados - Havana Branco	N/A	N/A	True	N/A	N/A
10589529	Kit Adaptador 5 Em 1 Iphone 5	apple	iphone 5	False	N/A	N/A
10638186	Bumper Iphone 4/4s Metal Brilho Roxo	apple	iphone 4	False	N/A	N/A
10638280	Bumper Duplo Iphone 6 Preto/Vermelho	apple	iphone 6	False	N/A	N/A
10638675	Bumper Duplo Iphone 6 Preto/Verde	apple	iphone 6	False	N/A	N/A
10641160	Smart Pad	N/A	N/A	False	N/A	N/A
10645753	Kit Capapelicula Iphone 4/4s Pc Bandeira Paises Usa - Idea	apple	iphone 4	False	N/A	N/A
10656982	"Smartphone Samsung Galaxy J2 Prime TV Preto com 8GB, Dual chip, Tela 5"", TV Digital, 4G, Câmera 8MP, Android 6.0 e Processador Quad Core de 1.4 Ghz"	samsung	galaxy j2	False	N/A	N/A
11051210	"Smartphone Samsung Galaxy S7 edge Black Piano com 128GB, Tela 5.5"", Android 6.0, 4G, Câmera 12MP, Processador Octa-Core e 4GB RAM"	samsung	galaxy s7	False	N/A	5.5
11051270	"Smartphone LG K10 Novo M250DS Preto com 32GB, Dual Chip, Tela de 5.3"" HD, 4G, Android 7.0, Câmera 13MP e Processador Octa Core de 1.5 GHz"	lg	N/A	False	N/A	5.3
11482037	Smartphone Samsung Galaxy S8 Plus Dual Chip Prata com 64GB, Tela 6.2”, Android 7.0, 4G, Câmera 12MP e Octa-Core	samsung	galaxy s8	True	N/A	6.2
11482047	"Smartphone Samsung Galaxy S8 Plus Dual Chip Ametista com 64GB, Tela 6.2"", Android 7.0, 4G, Câmera 12MP e Octa-Core"	samsung	galaxy s8	True	N/A	6.2
11516052	Smartphone Motorola Moto E4 XT1763 Ouro Rose com 16GB, Tela 5'', Dual Chip, Android 7.1, 4G, Câmera 8MP, Processador Quad-Core e 2GB de RAM	motorola	moto e4	False	N/A	N/A
11516082	Smartphone Motorola Moto E4 Plus Titanium 16GB, Tela 5.5'', Dual Chip, Android 7.1, Bateria 5.000 mAh, Câmera 13MP, Processador Quad-Core e 2GB de RAM	motorola	moto e4	True	N/A	5.5
11516101	Smartphone Motorola Moto Z2 Play Sound Edition Ouro 64GB, Tela 5.5'', Dual Chip, Câmera 12MP, Android 7.1, Processador Octa-Core e 4GB de RAM	motorola	moto z2	False	N/A	5.5
11516109	Smartphone Motorola Moto Z2 Play Power Edition Platinum 64GB, Tela 5.5'', Dual Chip, Câmera 12MP, Android 7.1, Processador Octa-Core e 4GB de RAM	motorola	moto z2	False	N/A	5.5
11516120	Smartphone Motorola Moto Z2 Play XT1710 Azul Topázio com 64GB, Tela de 5.5'', Dual Chip, Câmera 12MP, Android 7.1, Processador Octa-Core e 4GB de RAM	motorola	moto z2	False	N/A	5.5
11516848	Smartphone ASUS Zenfone 3 Zoom ZE553KL Prata com 32GB, Tela 5.5, Dual Chip, Android 6.0, 4G, Câmera Dual 12MP, Processador Octa-Core e 3GB de RAM	asus	zenfone 3 zoom	False	N/A	N/A
11548183	"Smartphone Samsung Galaxy J7 Neo Preto com 16GB, Tela 5.5"", Câmera 13MP, TV Digital HD, Dual Chip, Android, 7.0, Processador Octa Core e 2GB RAM"	samsung	galaxy j7	False	N/A	5.5
11614697	Smartphone LG K4 Novo, Titânio, X230DS,Tela de 5´´, 8GB, 8MP, OI	lg	N/A	False	N/A	N/A
11666282	Smartphone LG Q6+ Platinum com 64GB, Tela 5.5”, Android 7.0, 4G, Câmera 13MP, Processador Octa-Core e 4GB de RAM	lg	N/A	True	N/A	5.5
11700707	Smartphone Motorola Moto G5s Plus XT1802 Platinum 32GB, Tela 5.5'', Dual Chip, TV Digital, Android 7.1, Câmera Traseira Dupla 13MP e 3GB RAM	motorola	moto g5	True	N/A	5.5
11700716	Smartphone Motorola Moto G5s Plus XT1802 Ouro Rosé 32GB, Tela 5.5'', Dual Chip, TV Digital, Android 7.1, Câmera Traseira Dupla 13MP e 3GB RAM	motorola	moto g5	True	N/A	5.5
11811144	Smartphone Motorola Moto Z2 Play GamePad Edition Platinum 64GB, Tela 5.5'', Dual Chip, Câmera 12MP, Android 7.1, Processador Octa-Core e 4GB de RAM	motorola	moto z2	False	N/A	5.5
11822323	"Asus Zenfone 4 Max ZC554KL Preto com 16GB, Tela 5.5"", Dual Chip, Câmera Traseira Dupla, 4G, Android 7.0, Processador Quad Core e 2GB RAM"	asus	zenfone 4 max	False	N/A	5.5
11822328	"Asus Zenfone 4 Max ZC554KL Gold com 16GB, Tela 5.5"", Dual Chip, Câmera Traseira Dupla, 4G, Android 7.0, Processador Quad Core e 2GB RAM"	asus	zenfone 4 max	False	N/A	5.5
11822329	"Asus Zenfone 4 Max ZC554KL Rosa com 16GB, Tela 5.5"", Dual Chip, Câmera Traseira Dupla, 4G, Android 7.0, Processador Quad Core e 2GB RAM"	asus	zenfone 4 max	False	N/A	5.5
11822336	"Asus Zenfone 4 Selfie Pro ZD552KL Preto com 64GB, Tela 5.5"", Dual Chip, Câmera Frontal Dupla, Android 7.0, Processador Octa Core e 4GB RAM"	asus	zenfone 4 selfie pro	False	N/A	5.5
11822337	"Asus Zenfone 4 Selfie Pro ZD552KL Vermelho 64GB, Tela 5.5"", Dual Chip, Câmera Frontal Dupla, Android 7.0, Processador Octa Core e 4GB RAM"	asus	zenfone 4 selfie pro	False	N/A	5.5
11822340	"Smartphone Asus Zenfone 4 Selfie Pro ZD552KL Gold com 64GB, Tela 5.5"", Dual Chip, Câmera Frontal Dupla, Android 7.0, Processador Octa Core e 4GB RAM"	asus	zenfone 4 selfie pro	False	N/A	5.5
11822356	"Asus Zenfone 4 Selfie ZD553KL Gold com 64GB, Tela 5.5"", Dual Chip, Câmera Frontal Dupla, Android 7.0, Processador Octa Core e 4GB RAM"	asus	zenfone 4 selfie	False	N/A	5.5
11822364	"Smartphone Asus Zenfone 4 Max ZC554KL Rosa com 32GB, Tela 5.5"", Dual Chip, Câmera Traseira Dupla, 4G, Android 7.0, Processador Octa Core e 3GB RAM"	asus	zenfone 4 max	False	N/A	5.5
11822367	"Smartphone Asus Zenfone 4 Selfie ZD553KL Preto com 64GB, Tela 5.5"", Dual Chip, Câmera Frontal Dupla, Android 7.0, Processador Octa Core e 4GB RAM"	asus	zenfone 4 selfie	False	N/A	5.5
11822369	"Asus Zenfone 4 ZE554KL Verde com 64GB, Tela 5.5"", Dual Chip, Câmera Traseira Dupla, 4G, Android 7.0, Processador Octa Core e 4GB RAM"	asus	zenfone 4	False	N/A	5.5
11822372	"Asus Zenfone 4 Max ZC554KL Gold com 32GB, Tela 5.5"", Dual Chip, Câmera Traseira Dupla, 4G, Android 7.0, Processador Octa Core e 3GB RAM"	asus	zenfone 4 max	False	N/A	5.5
11822373	"Smartphone Asus Zenfone 4 Selfie ZD553KL Rose Gold com 64GB, Tela 5.5"", Dual Chip, Câmera Frontal Dupla, Android 7.0, Processador Octa Core e 4GB RAM"	asus	zenfone 4 selfie	False	N/A	5.5
11822377	"Smartphone Asus Zenfone 4 Selfie ZD553KL Verde com 64GB, Tela 5.5"", Dual Chip, Câmera Frontal Dupla, Android 7.0, Processador Octa Core e 4GB RAM"	asus	zenfone 4 selfie	False	N/A	5.5
11822381	"Smartphone Asus Zenfone 4 ZE554KL Preto com 64GB, Tela 5.5"", Dual Chip, Câmera Traseira Dupla, 4G, Android 7.0, Processador Octa Core e 6GB RAM"	asus	zenfone 4	False	N/A	5.5
11822386	"Smartphone Asus Zenfone 4 Max ZC554KL Preto com 32GB, Tela 5.5"", Dual Chip, Câmera Traseira Dupla, 4G, Android 7.0, Processador Octa Core e 3GB RAM"	asus	zenfone 4 max	False	N/A	5.5
11822388	"Smartphone Asus Zenfone 4 ZE554KL Verde com 64GB, Tela 5.5"", Dual Chip, Câmera Traseira Dupla, 4G, Android 7.0, Processador Octa Core e 6GB RAM"	asus	zenfone 4	False	N/A	5.5
11822392	"Smartphone Asus Zenfone 4 ZE554KL Preto com 64GB, Tela 5.5"", Dual Chip, Câmera Traseira Dupla, 4G, Android 7.0, Processador Octa Core e 4GB RAM"	asus	zenfone 4	False	N/A	5.5
11822393	"Smartphone Asus Zenfone 4 ZE554KL Branco com 64GB, Tela 5.5"", Dual Chip, Câmera Traseira Dupla, 4G, Android 7.0, Processador Octa Core e 4GB RAM"	asus	zenfone 4	False	N/A	5.5
11822405	"Asus Zenfone 4 ZE554KL Branco com 64GB, Tela 5.5"", Dual Chip, Câmera Traseira Dupla, 4G, Android 7.0, Processador Octa Core e 6GB RAM"	asus	zenfone 4	False	N/A	5.5
11823246	"Smartphone Sony Xperia XA1 G3116 Branco com 32GB, Tela 5"" HD, Dual Chip, Câmera 23MP, 4G, Android 7.0, Processador Octa-Core e 3GB RAM"	N/A	N/A	False	N/A	N/A
11823323	iPhone 8 Apple Plus com 64GB, Tela Retina HD de 5,5”, iOS 11, Dupla Câmera Traseira, Resistente à Água, Wi-Fi, 4G LTE e NFC - Cinza-Espacial	apple	iphone 8	True	N/A	N/A
11823349	iPhone 8 Apple Plus com 256GB, Tela Retina HD de 5,5”, iOS 11, Dupla Câmera Traseira, Resistente à Água, Wi-Fi, 4G LTE e NFC - Dourado	apple	iphone 8	True	N/A	N/A
11823357	iPhone 8 Apple Plus com 256GB, Tela Retina HD de 5,5”, iOS 11, Dupla Câmera Traseira, Resistente à Água, Wi-Fi, 4G LTE e NFC - Cinza-Espacial	apple	iphone 8	True	N/A	N/A
11823370	iPhone 8 Apple Plus com 256GB, Tela Retina HD de 5,5”, iOS 11, Dupla Câmera Traseira, Resistente à Água, Wi-Fi, 4G LTE e NFC – Prateado	apple	iphone 8	True	N/A	N/A
11823374	iPhone 8 Apple Plus com 64GB, Tela Retina HD de 5,5”, iOS 11, Dupla Câmera Traseira, Resistente à Água, Wi-Fi, 4G LTE e NFC - Dourado	apple	iphone 8	True	N/A	N/A
11823380	iPhone 8 Apple Plus com 64GB, Tela Retina HD de 5,5”, iOS 11, Dupla Câmera Traseira, Resistente à Água, Wi-Fi, 4G LTE e NFC - Prateado	apple	iphone 8	True	N/A	N/A
12138108	"Smartphone Samsung Galaxy A8 Plus Ametista com 64GB, Dual Chip, Display Infinito de 6"", Android 7.1, Câmera 16MP, Proteção IP68, Octa Core e RAM de 4G"	samsung	galaxy a8	True	N/A	N/A
12564960	"Smartphone Samsung Galaxy S9 Plus Cinza 128GB, Tela Infinita de 6.2"", Dual Chip, Android 8.0, Câmera Dupla de 12MP, 6GB de RAM e Processador Octa-Core"	samsung	galaxy s9	True	N/A	6.2
12564975	"Smartphone Samsung Galaxy S9 Plus Preto 128GB, Tela Infinita de 6.2"", Dual Chip, Android 8.0, Câmera Dupla de 12MP, 6GB de RAM e Processador Octa-Core"	samsung	galaxy s9	True	N/A	6.2
12727827	"Smartphone Motorola Moto G6 Plus XT1926 Índigo 64GB, Tela de 5.9"", Dual Chip, Android 8.0, Câmera Traseira Dupla, Processador Octa-Core e 4GB de RAM"	motorola	moto g6	True	N/A	5.9
12731640	iPhone 8 Plus Apple RED Special Edition 64GB Tela Retina HD 5.5” iOS11 Câmera Dupla 12MP Vermelho	apple	iphone 8	True	N/A	5.5
12731651	iPhone 8 Plus Apple RED Special Edition 256GB Tela Retina HD 5.5” iOS11 Câmera Dupla 12MP Vermelho	apple	iphone 8	True	N/A	5.5
12842708	Smartphone Motorola Moto E5 XT1944 Platinum com 16GB, Tela 5.7'', Dual Chip, Android 8.0, 4G, Câmera 13MP, Processador Quad-Core e 2GB de RAM	motorola	moto e5	False	N/A	5.7
22996794	"Smartphone Tp-link Neffos C5l 4g Lte 4.5"" 8gb Branco"	N/A	N/A	False	N/A	4.5
27797661	Motorola Moto C Plus XT1726	motorola	moto c	True	N/A	N/A
132118377	"Smartphone Samsung Galaxy S8+ Dual Chip Android 7.0 Tela 6.2"" Octa-Core 2.3 GHz 64GB Câmera 12MP - Preto"	samsung	galaxy s8	True	N/A	6.2
133274881	"Smartphone Samsung Galaxy J7 Prime 2 Dual Chip Android 7.1 Tela 5.5"" Octa-Core 1.6GHz 32GB 4G Câmera 13MP com TV - Dourado"	samsung	galaxy j7	False	N/A	5.5
133274988	"Smartphone Samsung Galaxy S9+ Dual Chip Android 8.0 Tela 6.2"" Octa-Core 2.8GHz 128GB 4G Câmera 12MP Dual Cam - Ultravioleta"	samsung	galaxy s9	True	N/A	6.2
668329644	Apple Iphone 5 16gb 100% Original Promoção Imperdivel!!!!!!!	apple	iphone 5	False	N/A	N/A
695726975	Apple Iphone 5s 16gb Desbloqueado Original Anatel De Vitrine	apple	iphone 5s	False	N/A	N/A
705112358	Apple Iphone 6 16gb Space Gray Original Nacional Vitrine	apple	iphone 6	False	N/A	N/A
708769702	Lançamento Smartphone Cat S61 Tela 5.2 64gb 4g Dual Sim	N/A	N/A	False	N/A	N/A
722631381	Apple Iphone 5s 16gb Original Desbloqueado Novo De Vitrine	apple	iphone 5s	False	N/A	N/A
722933035	Apple Iphone 5c 16gb Original Desbloqueado - De Vitrine	apple	iphone 5c	False	N/A	N/A
722936947	Iphone 5s 16gb Original Apple Desbloqueado Novo De Vitrine	apple	iphone 5s	False	N/A	N/A
723215907	Apple Iphone 5 16gb Original Novo De Vitrine	apple	iphone 5	False	N/A	N/A
725748489	Samsung Galaxy Pocket Plus S5301 Android 4.0 - De Vitrine	samsung	N/A	True	N/A	N/A
735473636	Celular Motorola Moto G6 Plus Dual 64gb 4gbram Tv Xt1926-8	motorola	moto g6	True	N/A	N/A
794323295	Smartphone Cat Caterpillar S60 Lte 32gb !! Pronta Entrega !!	N/A	N/A	False	N/A	N/A
795691568	Smartphone Celular Caterpillar Cat S60 32gb Câm Térmica 4g	N/A	N/A	False	N/A	N/A
807959902	Iphone 6 16gb Apple Tela 4,7 Original Apple Bluetooth	apple	iphone 6	False	N/A	N/A
807960504	Iphone 6 16gb Apple Tela 4,7 Garantia Novo Original Apple	apple	iphone 6	False	N/A	N/A
812468070	Iphone 5s 32gb Desbloqueado 100% Funcionando 3g 4g B	apple	iphone 5s	False	N/A	N/A
824511715	Imbativel Corra ! Motorola Moto G5 Xt1676 4g Orig+brinde+nf	motorola	moto g5	True	N/A	N/A
853248747	Motorola Moto C Plus 16gb Mem 4g Dual 2gb Ram	motorola	moto c	True	N/A	N/A
853252755	Motorola Moto C 16g Plus Quad Core Dual Sim Tela 5	motorola	moto c	True	N/A	N/A
853253538	Motorola Moto C Plus 16g Tela 5' Frete Grátis \o/	motorola	moto c	True	N/A	N/A
853254183	Smartphone Motorola Moto C Plus 16gb Mem 4g Dual 2gb Ram	motorola	moto c	True	N/A	N/A
860120184	Lg K10 Novo M250ds Titânio Até 12x Original Lacrado +nf	lg	N/A	True	N/A	N/A
873764184	Samsung Galaxy Grand Prime+ Plus Lacrado 4g Melhor J2 J3 J5	samsung	N/A	True	N/A	N/A
880918239	Iphone Apple 8 64gb Plus Debloq S/juros Leia Anúncio	apple	N/A	True	N/A	N/A
885751260	Novo Moto G5 Xt1676 16g Orig+brinde+nota Fiscal+frete Gratis	motorola	moto g5	True	N/A	N/A
896630415	Motorola Moto C Plus Dual Sim 16gb Tela 5 | 2gb Ram	motorola	moto c	True	N/A	N/A
896633212	Motorola Moto C Plus Xt1724 Dual Sim 16gb Tela 5	motorola	moto c	True	N/A	N/A
897909000	Test Item (no Ofertar) Iphone 4 8gb Nuevo	apple	iphone 4	False	N/A	N/A
900513018	+ Brindes Grátis+ Motorola Moto G4 Plus 32gb Xt1640 -vitrine	motorola	moto g4	True	N/A	N/A
914278399	Apple Iphone 5s 16gb 4g 100% Original  Promoção Envio Já	apple	iphone 5s	False	N/A	N/A
918208411	Apple Iphone 5s 16gb 100% Original Promoção Imperdivel!!!!!!	apple	iphone 5s	False	N/A	N/A
919481440	Moto G5 Xt1671 Novo 32gb Orig+brinde+nota Fiscal	motorola	moto g5	True	N/A	N/A
920970470	Zenfone 4 Selfie Dourado Asus 4g 64gb 4gb 20+8 Mp - Zd553kl	asus	zenfone 4 selfie	True	N/A	N/A
921979732	Iphone 5s 16gb Original Com Nota Fiscal Danfe	apple	iphone 5s	False	N/A	N/A
926801056	Celular Motorola G5 32gb Android Tela 5 Câmera 13mp + Fone	motorola	N/A	True	N/A	N/A
927874482	Apple Iphone 8 Plus 64gb Novo Lacrado 1 Ano De Garantia +nf	apple	iphone 8	True	N/A	N/A
928464267	Motorola Moto C Plus Xt1723 Dual Chip 16gb Preto Dourado	motorola	moto c	True	N/A	N/A
929531936	Motorola Moto C Plus Xt1724 Dual 16gb Tela 5 + Fone	motorola	moto c	True	N/A	N/A
929580295	Iphone 8 64gb Novo Lacrado Anatel Garantia Pela Apple 1 Ano	apple	iphone 8	False	N/A	N/A
929583341	Iphone 8 Plus 64gb Novo Lacrado Origina Garantia 1 Ano Apple	apple	iphone 8	True	N/A	N/A
938289971	Iphone 8 Apple Plus 256gb 01 Ano De Garantia Envio Imediato	apple	iphone 8	True	N/A	N/A
938747422	Smartphone Samsung Galaxy J7 Pro Preto Tela 5,5'' Android 7.	samsung	galaxy j7	False	N/A	N/A
949335507	Iphone 8 256gb Dourado	apple	iphone 8	False	N/A	N/A
959701549	Iphone 8 Plus 64gb Original Lacrado Homologado Atanel	apple	iphone 8	True	N/A	N/A
963492882	Iphone 6 64gb Apple Original 4g 4'7 Rfb Desb A Vista R$1.499	apple	iphone 6	False	N/A	N/A
963744829	Smartphone Celular Original Lg K4 8gb 2017 2 Chips Quad Core	lg	N/A	False	N/A	N/A
963749292	Iphone X 64gb Novo Lacrado Cpo Original Garantia 1 Ano Apple	apple	iphone x	False	N/A	N/A
969416016	Iphone 5s 16gb Novo! Lacrado! Original! Garantia 3 Meses	apple	iphone 5s	False	N/A	N/A
969476546	Iphone X 256gb 1 Ano De Garantia Apple. Pronta Entrega	apple	iphone x	False	N/A	N/A
971694246	Galaxy J2 Prime 4g Samsung Smartphone 8gb Original	samsung	galaxy j2	False	N/A	N/A
978883952	Iphone X 256gb  Novo! Lacrado!  Cpo! 1 Ano De Garantia Apple	apple	iphone x	False	N/A	N/A
980833540	Apple Iphone 8 Plus 64gb Lacrado - Com Nota Fiscal	apple	iphone 8	True	N/A	N/A
983449457	Iphone X 64gb Apple Lacrado	apple	iphone x	False	N/A	N/A
987076762	Iphone Apple X 256gb Orig Grt Apple Leia Anuncio Original	apple	N/A	False	N/A	N/A
987549391	Motorola Moto C Plus Xt-1723 - 5.0 Polegadas + Nf	motorola	moto c	True	N/A	N/A
988804788	Xiaomi Redmi 5 Plus 64gb 4gb Dual Chip Rom Global Tela 5,99'	xiaomi	redmi 5	True	N/A	N/A
989085729	Smartphone Motorola Moto Z2 Play Polaroid Edition Dualchip	motorola	moto z2	False	N/A	N/A
989752218	Iphone 5s 16gb Novo Lacrado Garantia Vendedor 6 Meses	apple	iphone 5s	False	N/A	N/A
990651418	Moto C Plus 16gb 4g Original Dourado	motorola	moto c	True	N/A	N/A
991263900	Galaxy S8 Plus 64gb Duos Dual Chip Samsung Novo De Vitrine	samsung	galaxy s8	True	N/A	N/A
992802586	Apple Iphone 7 128gb Original 4g Nacional 12mpx Ios| Vitrine	apple	iphone 7	False	N/A	N/A
993672482	Smartphone Apple Iphone 5c 16gb Original Apple	apple	iphone 5c	False	N/A	N/A
994136442	Moto C Plus Xt1723 Dourado 2º Geração 2gb Ram +16 Gb 2 Chip	motorola	moto c	True	N/A	N/A
996979135	Smartphone Apple Iphone 8 Plus 64gb Tela 5,5	apple	iphone 8	True	N/A	N/A
998507121	Grátis Brindes Celular Iphone 5s 16gb - Leia Todo O Anúncio!	apple	iphone 5s	False	N/A	N/A
999595044	Iphone X 256gb Novo Lacrado Original Apple Garantia 1 Ano	apple	iphone x	False	N/A	N/A
999620409	Apple Iphone X 256gb 1 Ano De Garantia Anatel Original !	apple	iphone x	False	N/A	N/A
1001010116	Xiaomi Redmi 5 Plus 32gb 3gb Dual Chip Rom Global Tela 5,99'	xiaomi	redmi 5	True	N/A	N/A
1001967837	Motorola C Plus Xt1723 Dual 16gb - Original Com Nf	motorola	N/A	True	N/A	N/A
1001975907	Iphone Apple X 64gb Novo Lacrado 5.8 Garantia De 01 Ano!	apple	N/A	False	N/A	N/A
1002167408	Celular Smartphone Samsung Galaxy S9+ Preto 128gb	samsung	galaxy s9	True	N/A	N/A
1002289092	Iphone X 64gb Prata Envio Imediato 1 Ano Garantia Brasil	apple	iphone x	False	N/A	N/A
1005566988	Smartphone Samsung Galaxy J2 Pro Preto, Tela 5  Android 7.1,	samsung	galaxy j2	False	N/A	N/A
1006396800	Motorola Moto E4 Plus Xt1771 Xt1773 16gb 5.5 Gold	motorola	moto e4	True	N/A	N/A
1008654818	Smartphone Motorola Moto C Plus Android 7.0 16gb Dual Chip	motorola	moto c	True	N/A	N/A
1010484705	Iphone 7 Plus 256gb Lacrado Nf Garantia Apple + 2 Brindes	apple	iphone 7	True	N/A	N/A
1010668106	Iphone X 256 Gb Novo Lacrado Anatel Cpo	apple	iphone x	False	N/A	N/A
1012139183	Smartphone Xiaomi Redmi Mi A2 Lite 64gb Dual 4gb Ram Global	xiaomi	mi a2	False	N/A	N/A
1012227269	Apple Iphone 7 Plus 256gb Lacrado Garantia Um Ano +2 Brindes	apple	iphone 7	True	N/A	N/A
1012568407	Smartphone Samsung A530f Galaxy A8 Duos Dual Tela 5.6 64gb	samsung	galaxy a8	False	N/A	N/A
1015961356	Smartphone Xiaomi Redmi 5 Plus 32gb Gold Novo	xiaomi	redmi 5	True	N/A	N/A
1016700656	Samsung Galaxy S9 Plus 128gb 6gb Ram Nacional + Nf	samsung	galaxy s9	True	N/A	N/A
1017031802	Samsung A8 + Plus A730 Lançamento 64gb Tela 6 Novo 4gb Ram	samsung	N/A	True	N/A	N/A
1018417200	Smartphone Moto C Xt1758 16gb Tela 5 5mp/2mp 100%original	motorola	moto c	False	N/A	N/A
1018580732	Motorola Moto G6 Plus 64gb Índigo Xt1926/i	motorola	moto g6	True	N/A	N/A
1020035570	Smartphone Motorola Moto G6 Plus 64gb 4gb Octacore - Índigo	motorola	moto g6	True	N/A	N/A
1022593405	Apple Iphone 8 64gb (lacrado Original) - Red (vermelho)	apple	iphone 8	False	N/A	N/A
1023148781	Iphone 6 Plus 64gb Tela 5'5 12mp 4k Touchid Apple Rfb Desbl.	apple	iphone 6	True	N/A	N/A
1023339086	Smartphone Samsung Galaxy J7 Neo Tv Tela 5.5 , Android	samsung	galaxy j7	False	N/A	N/A
1023779967	Iphone 8 Plus 64gb 4g Com 1 Ano Garantia Apple Nota Fiscal	apple	iphone 8	True	N/A	N/A
1025607795	Apple Iphone 8 Plus 64gb Anatel	apple	iphone 8	True	N/A	N/A
1025788464	Celular Motorola Moto G6 Plus 64gb 4gb Octacore 2.2ghz	motorola	moto g6	True	N/A	N/A
1027402963	Celular Smartphone Motorola Moto C Xt1750 8gb Dual Chip	motorola	moto c	False	N/A	N/A
1027914836	Celular Samsung Galaxy S9 Plus Preto 128gb Tela Infinita 6.2	samsung	galaxy s9	True	N/A	N/A
1029075911	Smartphone Motorola Moto Z2 Play 64gb Gold Xt1710-08	motorola	moto z2	False	N/A	N/A
1029807147	Smartphone Moto E4 Plus 5.5 16gb Biometria Dual Sim	motorola	moto e4	True	N/A	N/A
1030257890	Smartphone Galaxy S9 +(plus) 128 Gb Preto	samsung	galaxy s9	True	N/A	N/A
1030654364	Smartphone Samsung Galaxy J7 Neo 16gb Tv Dual Octa Dourado	samsung	galaxy j7	False	N/A	N/A
1030654602	Smartphone Samsung Galaxy J7 Neo 16gb Tv Dual Octa Preto	samsung	galaxy j7	False	N/A	N/A
